Actors,Awards,Box Office,Country,Director,Genre,Rated,Title,Writer(s),Year,imdbRating
"Rami Malek, Lucy Boynton, Gwilym Lee, Ben Hardy",N/A,"$89,604","UK, USA",Bryan Singer,"Biography, Drama, Music",PG-13,Bohemian Rhapsody,"Anthony McCarten (story by), Peter Morgan (story by), Anthony McCarten (screenplay by)",2018,8.3
"Chadwick Boseman, Michael B. Jordan, Lupita Nyong'o, Danai Gurira",14 nominations.,"$501,105,037","USA, South Africa, South Korea, Australia",Ryan Coogler,"Action, Adventure, Sci-Fi",PG-13,Black Panther,"Ryan Coogler, Joe Robert Cole, Stan Lee (based on the Marvel comics by), Jack Kirby (based on the Marvel Comics by)",2018,7.4
"Alec Baldwin, John David Washington, Isiah Whitlock Jr., Robert John Burke",N/A,N/A,USA,Spike Lee,"Biography, Crime, Drama",R,BlacKkKlansman,"Charlie Wachtel, David Rabinowitz, Kevin Willmott, Spike Lee, Ron Stallworth (based on the book by)",2018,7.5
"Olivia Colman, Rachel Weisz, Emma Delves, Faye Daveney",N/A,N/A,"Ireland, UK, USA",Yorgos Lanthimos,"Biography, Comedy, Drama, History",R,The Favourite,"Deborah Davis, Tony McNamara",2018,7.9
"Yalitza Aparicio, Marina de Tavira, Diego Cortina Autrey, Carlos Peralta",N/A,N/A,"Mexico, USA",Alfonso Cuarón,Drama,R,Roma,Alfonso Cuarón,2018,8.0
"Lady Gaga, Bradley Cooper, Sam Elliott, Andrew Dice Clay",1 nomination.,N/A,USA,Bradley Cooper,"Drama, Music, Romance",R,A Star Is Born,"Eric Roth (screenplay by), Bradley Cooper (screenplay by), Will Fetters (screenplay by), Moss Hart (based on the 1954 screenplay by), John Gregory Dunne (based on the 1976 screenplay by), Joan Didion (based on the 1976 screenplay by), Frank Pierson (based on the 1976 screenplay by), William A. Wellman (based on a story by), Robert Carson (based on a story by)",2018,8.0
"Christian Bale, Amy Adams, Steve Carell, Sam Rockwell",N/A,N/A,USA,Adam McKay,"Biography, Comedy, Drama, History",R,Vice,Adam McKay,2018,7.1
"Viggo Mortensen, Mahershala Ali, Linda Cardellini, Sebastian Maniscalco",N/A,N/A,USA,Peter Farrelly,"Biography, Comedy, Drama, Music",PG-13,Green Book,"Nick Vallelonga, Brian Hayes Currie, Peter Farrelly",2018,8.3
